{
  "$schema": "http://json-schema.org/draft-07/schema#",
  "title": "RequirementBrief",
  "type": "object",
  "required": [
    "project_id",
    "title",
    "request_type",
    "problem_statement",
    "target_users",
    "business_goal",
    "urgency",
    "facts",
    "assumptions",
    "open_questions"
  ],
  "properties": {
    "project_id": {
      "type": "string"
    },
    "title": {
      "type": "string"
    },
    "request_type": {
      "type": "string",
      "enum": [
        "new_feature",
        "optimization",
        "bugfix",
        "compliance",
        "tech_debt",
        "other"
      ]
    },
    "requester": {
      "type": "string"
    },
    "channel": {
      "type": "string"
    },
    "business_context": {
      "type": "string"
    },
    "problem_statement": {
      "type": "string"
    },
    "target_users": {
      "type": "array",
      "items": {
        "type": "string"
      }
    },
    "scenarios": {
      "type": "array",
      "items": {
        "type": "string"
      }
    },
    "business_goal": {
      "type": "string"
    },
    "urgency": {
      "type": "string",
      "enum": [
        "p0",
        "p1",
        "p2",
        "p3",
        "unknown"
      ]
    },
    "desired_launch_date": {
      "type": [
        "string",
        "null"
      ]
    },
    "evidence": {
      "type": "array",
      "items": {
        "type": "string"
      }
    },
    "facts": {
      "type": "array",
      "items": {
        "type": "string"
      }
    },
    "assumptions": {
      "type": "array",
      "items": {
        "type": "string"
      }
    },
    "constraints": {
      "type": "array",
      "items": {
        "type": "string"
      }
    },
    "dependencies": {
      "type": "array",
      "items": {
        "type": "string"
      }
    },
    "open_questions": {
      "type": "array",
      "items": {
        "type": "string"
      }
    },
    "suggested_scope": {
      "type": "object",
      "properties": {
        "mvp": {
          "type": "array",
          "items": {
            "type": "string"
          }
        },
        "v1": {
          "type": "array",
          "items": {
            "type": "string"
          }
        },
        "later": {
          "type": "array",
          "items": {
            "type": "string"
          }
        }
      },
      "additionalProperties": false
    }
  },
  "additionalProperties": false
}