{
  "project_id": "demo-project",
  "title": "商家财务流水批量导出",
  "request_type": "new_feature",
  "requester": "销售、客服（原始输入未指明具体人）",
  "channel": "原始需求输入",
  "business_context": "销售反馈大客户提出批量导出财务流水需求；客服在月底频繁收到报表催促；当前商家对账效率较低。",
  "problem_statement": "当前缺少商家财务流水批量导出能力，导致大客户报表诉求无法高效满足，客服月底被动响应报表需求，对账效率低；同时导出字段范围与权限边界尚未确认。",
  "target_users": [
    "商家客户（尤其大客户）",
    "客服",
    "销售",
    "财务/对账相关内部人员"
  ],
  "scenarios": [
    "商家在月底或结算周期内需要批量导出财务流水用于对账和内部报表",
    "销售在推进大客户合作时，需要提供财务流水批量导出能力作为交付能力之一",
    "客服响应商家报表诉求时，需要快速提供可下载的财务流水数据",
    "内部财务或运营人员需要基于导出数据辅助排查账务问题"
  ],
  "business_goal": "提升商家对账效率，降低客服月底人工报表响应压力，满足大客户财务流水导出诉求，支持销售成交与客户维护。",
  "urgency": "p1",
  "desired_launch_date": "未提供",
  "evidence": [
    "销售反馈有大客户要求批量导出财务流水",
    "客服月底经常被追着要报表",
    "当前对账效率低",
    "字段和权限范围未确认"
  ],
  "facts": [
    "已存在来自销售渠道的大客户导出诉求",
    "客服在月底频繁收到报表需求催促",
    "当前对账效率较低",
    "导出字段范围尚未确认",
    "数据权限范围尚未确认"
  ],
  "assumptions": [
    "当前系统可能已有单次查询或非批量查看能力，但缺少标准化批量导出能力",
    "需求优先面向商家财务流水场景，而非所有报表类型",
    "月底是高频使用时段，导出需求可能与月结/对账周期强相关",
    "若字段和权限定义清晰，批量导出可显著降低客服人工处理成本"
  ],
  "constraints": [
    "字段范围未明确，无法直接确认导出模板",
    "权限边界未明确，存在数据越权风险",
    "原始输入未提供目标数据量、导出频次、文件格式和性能要求",
    "原始输入未说明是否涉及合规、脱敏、审计留痕要求"
  ],
  "dependencies": [
    "财务流水数据源及字段口径确认",
    "权限模型确认（商家可见范围、子账号范围、客服代导出权限等）",
    "导出文件格式与模板设计确认",
    "可能需要后端导出任务能力与下载链路支持",
    "可能需要审计日志、数据脱敏或合规评审支持"
  ],
  "open_questions": [
    "导出的核心目标用户是谁：商家自助导出，还是客服后台代导出，或两者都要？",
    "“财务流水”具体包含哪些业务单据/资金变动类型？",
    "导出字段清单、字段定义、排序方式、筛选条件分别是什么？",
    "数据权限如何定义：按商家、门店、账号、时间范围还是资金账户隔离？",
    "是否允许导出全部历史数据？单次最大时间跨度和最大数据量是多少？",
    "导出形式是同步下载还是异步任务？是否需要邮件/站内通知？",
    "支持哪些文件格式（CSV、Excel）？是否有模板要求？",
    "是否需要脱敏字段（如账户信息、联系人信息）？",
    "是否需要操作审计、审批流或水印？",
    "成功指标如何定义：客服工单下降、导出使用率、对账耗时下降、成交支持数等？",
    "期望上线时间和客户承诺时间是什么？"
  ],
  "suggested_scope": {
    "mvp": [
      "支持在后台按商家和时间范围筛选财务流水并导出",
      "明确首版最小字段集与字段口径",
      "明确基础权限规则，避免越权导出",
      "支持常见文件格式导出（如CSV或Excel二选一）",
      "支持客服或内部运营代商家导出（若这是当前最高优先级场景）"
    ],
    "v1": [
      "支持商家自助导出财务流水",
      "支持异步导出任务与大数据量处理",
      "支持更多筛选条件（流水类型、订单号、结算状态等）",
      "增加导出记录、审计日志和下载有效期控制",
      "支持字段配置优化与标准报表模板"
    ],
    "later": [
      "支持定时报表订阅/自动发送",
      "支持多维汇总报表与自定义字段",
      "支持更细粒度权限控制和审批流程",
      "支持API导出或与客户财务系统集成"
    ]
  }
}
