{
  "project_id": "taxi-hailing-prd-test",
  "title": "打车产品 PRD 测试输入",
  "request_type": "new_feature",
  "requester": "产品测试",
  "channel": "结构回归测试",
  "business_context": "出行服务",
  "problem_statement": "用户在高峰期叫车等待不确定，价格不透明，司机接单和乘客等待状态不清楚，平台缺少基础订单闭环和安全兜底。，导致无法验证最新 PRD 结构是否被改坏，也无法发现原型说明、页面跳转、目标指标后置后的阅读问题。。",
  "target_users": [
    "乘客",
    "司机",
    "客服",
    "运营",
    "管理员"
  ],
  "scenarios": [
    "客服协助查询场景"
  ],
  "business_goal": "降低无法验证最新 PRD 结构是否被改坏，也无法发现原型说明、页面跳转、目标指标后置后的阅读问题。",
  "urgency": "unknown",
  "desired_launch_date": "待定",
  "evidence": [
    "测试样例",
    "用于检查 PRD 模板",
    "章节顺序",
    "页面说明和流程表达是否可读。"
  ],
  "facts": [
    "需求标题：城市即时打车平台 MVP",
    "提出人：产品测试",
    "来源渠道：结构回归测试",
    "业务线：出行服务",
    "希望上线时间：待定",
    "需求类型：新增功能",
    "原始描述：面向城市用户提供即时叫车服务，用户可以选择起终点、查看预估价格、提交订单、等待司机接单、查看司机位置、完成行程并支付。司机可以接单、导航到乘客上车点、开始行程、结束行程。平台需要基础派单、订单状态、价格预估、支付、客服和安全风控。",
    "当前痛点：用户在高峰期叫车等待不确定，价格不透明，司机接单和乘客等待状态不清楚，平台缺少基础订单闭环和安全兜底。",
    "影响角色：乘客、司机、客服、运营、管理员",
    "影响规模 / 证据：测试样例，用于检查 PRD 模板、章节顺序、页面说明和流程表达是否可读。",
    "不做的后果：无法验证最新 PRD 结构是否被改坏，也无法发现原型说明、页面跳转、目标指标后置后的阅读问题。",
    "现有假设：一期先做城市内即时打车，不做拼车、顺风车、预约用车、企业用车、会员体系。",
    "依赖项：地图定位、路线规划、司机定位、支付系统、短信/推送、客服系统、风控规则、订单数据库",
    "待确认问题：首城范围、计价规则、司机准入规则、安全联系人是否一期做、支付渠道、取消费规则、客服介入标准、是否需要发票"
  ],
  "assumptions": [
    "一期先做城市内即时打车",
    "不做拼车",
    "顺风车",
    "预约用车",
    "企业用车",
    "会员体系。"
  ],
  "constraints": [
    "目标上线时间：待定"
  ],
  "dependencies": [
    "地图定位",
    "路线规划",
    "司机定位",
    "支付系统",
    "短信",
    "推送",
    "客服系统",
    "风控规则",
    "订单数据库"
  ],
  "open_questions": [
    "首城范围",
    "计价规则",
    "司机准入规则",
    "安全联系人是否一期做",
    "支付渠道",
    "取消费规则",
    "客服介入标准",
    "是否需要发票"
  ],
  "suggested_scope": {
    "mvp": [
      "先覆盖最高频主流程",
      "补齐最小可用校验与权限"
    ],
    "v1": [
      "补齐次要场景"
    ],
    "later": [
      "扩展低频增强能力"
    ]
  }
}
