{
  "project_id": "fitness-app-mvp",
  "title": "健身 APP MVP 需求梳理：食物热量拍摄计算 + 组间歇闹钟",
  "request_type": "new_feature",
  "requester": "未明确",
  "channel": "需求原始输入",
  "business_context": "拟启动一款健身 / 减脂 / 训练辅助类 APP 的 MVP，当前已提出两个核心能力：通过拍照识别食物并估算热量，以及在力量训练或间歇训练中提供组间歇闹钟。整体产品定位、首发平台、基础能力范围和 MVP 边界仍待确认。",
  "problem_statement": "用户在饮食管理和训练执行中存在两类明显阻力：一是记录食物热量门槛高，二是训练时休息时长不规范、影响训练节奏。希望通过拍照估算热量降低饮食记录成本，并通过组间歇闹钟辅助用户按计划休息。",
  "target_users": [
    "泛健身人群（待确认）",
    "减脂人群（待确认）",
    "增肌人群（待确认）",
    "力量训练用户（待确认）",
    "间歇训练用户（待确认）"
  ],
  "scenarios": [
    "用户在吃饭前或吃饭后拍摄食物照片，获取热量估算结果",
    "用户希望快速记录饮食，但不想手动搜索和输入食物信息",
    "用户在力量训练过程中需要按组进行休息倒计时",
    "用户在间歇训练过程中需要重复进行训练/休息计时提醒",
    "用户希望通过工具减少训练中看表、记时和估算热量的负担"
  ],
  "business_goal": "验证健身 APP MVP 的核心用户价值是否成立：用户是否愿意为“低门槛饮食热量记录”和“训练间歇计时辅助”持续使用产品，并据此确定后续完整产品形态。",
  "urgency": "unknown",
  "desired_launch_date": "未提供",
  "evidence": [
    "原始需求明确提出“现在要做一个健身 APP”",
    "原始需求明确要求核心功能包含“食物热量拍摄计算”",
    "原始需求明确要求核心功能包含“组间歇闹钟”",
    "当前理解中明确了两个核心价值：降低饮食记录门槛、规范训练休息时长",
    "输入中显式列出了多个未确认项，说明需求边界尚未收敛"
  ],
  "facts": [
    "项目标识为 fitness-app-mvp",
    "需求方向为健身 APP MVP",
    "已明确的两个核心功能是食物热量拍摄计算和组间歇闹钟",
    "当前产品方向被描述为健身 / 减脂 / 训练辅助类 APP",
    "已知存在若干未确认项，包括目标用户、首发平台、功能深度、基础能力和 MVP 范围"
  ],
  "assumptions": [
    "本次需求处于早期立项或需求收敛阶段，尚未进入详细方案冻结",
    "MVP 目标可能是优先验证核心场景价值，而非一次性建设完整健身产品",
    "食物热量拍摄计算可能依赖图像识别或第三方 AI/食物数据库能力",
    "组间歇闹钟的最小实现形态可能是简单倒计时，而非完整训练计划系统",
    "首期版本可能不包含账号体系、会员付费和完整数据沉淀能力，但需确认",
    "若双核心功能同时上线，产品需要至少提供基础导航或入口组织方式"
  ],
  "constraints": [
    "当前需求信息不完整，多个关键产品决策尚未确认",
    "无法从现有输入判断平台优先级（iOS、Android 或双端）",
    "无法从现有输入确定食物热量识别的准确率目标、数据来源和可用地域",
    "无法从现有输入确定闹钟是否必须支持后台运行、语音提醒等系统级能力",
    "MVP 范围尚未明确，可能影响信息架构、技术方案和排期",
    "若涉及拍照识别食物热量，可能受限于模型能力、食物数据库覆盖率和图片质量"
  ],
  "dependencies": [
    "食物识别与热量估算能力，可能依赖自研模型、第三方 AI 服务或第三方食物数据库",
    "移动端相机、相册、通知、音频与后台运行等系统能力",
    "产品需确认首发平台及对应开发资源",
    "若需要历史记录、账号体系或跨端同步，则依赖后端服务与数据存储能力",
    "若需要训练计划联动，则依赖训练动作、计划和计时状态管理设计"
  ],
  "open_questions": [
    "目标用户优先是谁：减脂人群、增肌人群，还是泛健身人群？",
    "首发平台是 iOS、Android，还是双端同时上线？",
    "食物热量计算是否仅支持拍照估算，还是还需支持手动修正、份量调整、历史记录？",
    "组间歇闹钟是否仅需简单倒计时，还是要支持训练计划联动、动作切换、语音提醒、后台运行？",
    "是否需要账号体系、训练记录、饮食记录、体重记录、会员付费等基础能力？",
    "第一期 MVP 只做两个核心功能，还是需要形成完整首页/训练页/饮食页闭环？",
    "MVP 成功的核心指标是什么：下载、次日留存、拍照记录次数、训练计时使用次数，还是付费转化？",
    "食物热量估算的准确率容忍度和错误兜底方案是什么？",
    "组间歇闹钟是否需要支持锁屏、后台、耳机/手表/通知提醒等使用场景？"
  ],
  "suggested_scope": {
    "mvp": [
      "提供食物拍照并返回热量估算结果的基础能力",
      "提供组间歇闹钟基础倒计时能力",
      "为两个功能提供清晰可进入的基础页面或入口",
      "记录最基础的使用行为数据，用于验证核心功能使用情况",
      "明确提示热量结果为估算值，降低用户对绝对准确性的预期风险"
    ],
    "v1": [
      "食物热量结果支持手动修正或份量调整",
      "提供饮食历史记录",
      "组间歇闹钟支持后台运行和提醒增强",
      "支持多组连续计时或自定义训练/休息时长",
      "优化信息架构，形成训练页/饮食页等基础闭环"
    ],
    "later": [
      "账号体系与多端同步",
      "训练记录、饮食记录、体重记录等长期追踪能力",
      "训练计划联动、动作切换、语音提醒等高级训练辅助能力",
      "会员付费体系",
      "更完整的健身内容、个性化建议或 AI 教练能力"
    ]
  }
}
